Timestamp,UserID,UserType,Sentence
,chatGPT5,LLM,Odorless fragrant smells disappear loudly.
,chatGPT5,LLM,Even odd numbers bleed dryly.
,chatGPT5,LLM,Silent noises shout mutely.
,chatGPT5,LLM,Infinite largest integers dance politely.
,chatGPT5,LLM,Living dead statues breathe digitally.
,chatGPT5,LLM,Prime composite numbers smile chemically.
,chatGPT5,LLM,Tangible abstract ideas itch hydraulically.
,chatGPT5,LLM,Stationary moving mountains sprint immovably.
,chatGPT5,LLM,Flat curved planes wrinkle vertically.
,chatGPT5,LLM,Wooden metallic clouds digest clockwise.
,chatGPT5,LLM,Finite endless lines stop perpetually.
,chatGPT5,LLM,Transparent opaque thoughts collide fragrantly.
,chatGPT5,LLM,"If butter forgets, planets applaud politely."
,chatGPT5,LLM,"After midnight, triangles borrow weather from whispers."
,chatGPT5,LLM,There were umbrellas arguing under the algorithm.
,chatGPT5,LLM,Neither oxygen nor boredom files the horizon.
,chatGPT5,LLM,A cautious echo paints thunder for breakfast.
,chatGPT5,LLM,"Because pencils migrate, the river resumes duty."
,chatGPT5,LLM,The museum pretends that teacups are monarchs.
,chatGPT5,LLM,"As calculators blush, lint negotiates silence."
,chatGPT5,LLM,"Under the keyboard, Tuesday practices remorse."
,chatGPT5,LLM,A rumor balanced the telescope backwards.
,chatGPT5,LLM,Let velvet measure tomorrow with raisins.
,chatGPT5,LLM,An obedient rumor divided the staircase.
,chatGPT5,LLM,Only the wallpaper suspects cheerful algebra.
,chatGPT5,LLM,This elegy instructs the elevator sideways.
,chatGPT5,LLM,The comet politely steals my staircase.
9/17/2025 11:01:36,user_1758124827256_y9ln3p3wi,human,Bottom of the space is up.
9/17/2025 11:01:54,user_1758051763255_jmqqrptso,human,Burpy trees monkey in mountain poodle.
9/17/2025 11:01:54,user_1758124843495_srcbljz55,human,Brightly veracious lion fly cunningly.
9/17/2025 11:02:08,user_1758124832579_f9b9deb5v,human,Delicious computer flies largely.
9/17/2025 11:02:17,user_1758124837240_t56m9cpew,human,The old man the boat.
9/17/2025 11:02:35,user_1758124822608_fyryc4t3i,human,More rugs have been debunked than in blue green dreams.
9/17/2025 11:02:36,user_1758124833022_cwzsxsjt4,human,Thoughtless bouncing fables sink gracefully.
9/17/2025 11:02:35,user_1758124826911_9va5zzx9b,human,Nonexistent tall freedoms lift monstrously.
9/17/2025 11:02:55,user_1758124836074_gmp2eo86u,human,"The shoe collated a quandary of bees by first mitigating meaning, then devouring the experiment."
9/17/2025 11:03:34,user_1758124827160_0b8pvp46u,human,Cactus slides toward the soap bridge upon each civilized dream.
9/17/2025 11:03:34,user_1758124819340_rgsvgdlel,human,Unknowable facts march pointlessly.
9/17/2025 11:03:43,user_1758124830096_to1vxr8co,human,Gentle cranky cat sing sleepily.
9/17/2025 11:05:04,user_1758124876200_uif9e3991,human,Opaque air drives restlessly among lakes.
9/17/2025 11:05:05,user_1758124827160_0b8pvp46u,human,My mine mobbed my mean meme moment moving mightily.
9/17/2025 11:06:57,user_1758124827160_0b8pvp46u,human,Since there is a sentence to be sentenced since sinners sensed the seriousness soon such sentence starts somewhere sideways.
9/17/2025 11:09:27,user_1758124827160_0b8pvp46u,human,Cheese chick checks around an android but bumping boom.